{
  "schemaVersion": 1,
  "projectId": "silent-orbit-skills-library",
  "generatedAt": "2026-07-25T12:00:00.000Z",
  "snapshotRefs": {
    "inventory": "inventory-snapshot:schemaversion-1-projectid-silent-orb:4d1cb2d6cf14",
    "library": "library-snapshot:schemaversion-1-projectid-silent-orb:0a7cd9f5a394"
  },
  "renderer": {
    "theme": "silent-orbit",
    "defaultRoute": "/"
  },
  "locales": [
    "zh-CN",
    "en-US"
  ],
  "summary": {
    "skills": 153,
    "libraries": 28,
    "categories": 9,
    "collections": 1
  },
  "privacy": {
    "includesLocalOnly": false,
    "publicVisibilities": [
      "public",
      "creator-showcase"
    ]
  }
}
